{
  "$schema": "https://json-schema.org/draft/2020-12/schema",
  "$id": "https://github.com/darklordVirtual/autonomous-ot-control/contracts/ot-authority-submission-v1.schema.json",
  "title": "ot-authority-submission/v1",
  "description": "What a delegation owner (APS) supplies for an authority_fixture set: per case the complete signed delegation as a file, its id, how it was built, the call to test and what the work-order check must answer. The testbed writes and signs the work orders and seals the set (runner.authority_fixtures assemble). Contract: docs/federation/authority-fixture-contract.md.",
  "type": "object",
  "additionalProperties": false,
  "required": [
    "schema",
    "set_id",
    "source",
    "delegation_format",
    "cases"
  ],
  "properties": {
    "schema": {
      "const": "ot-authority-submission/v1"
    },
    "set_id": {
      "type": "string",
      "pattern": "^[A-Za-z0-9][A-Za-z0-9._-]{0,127}$"
    },
    "source": {
      "type": "object",
      "required": [
        "project",
        "repository",
        "revision"
      ],
      "properties": {
        "project": {
          "type": "string"
        },
        "repository": {
          "type": "string"
        },
        "revision": {
          "type": "string",
          "minLength": 7
        }
      },
      "description": "Who built the delegations, at which pinned revision."
    },
    "delegation_format": {
      "type": "string"
    },
    "scope": {
      "type": "string"
    },
    "building_id": {
      "type": "string"
    },
    "delegation_root_keys": {
      "type": "object",
      "additionalProperties": {
        "type": "string",
        "pattern": "^[A-Za-z0-9_-]{43}$"
      }
    },
    "delegation_signer_keys": {
      "type": "object",
      "additionalProperties": {
        "type": "string",
        "pattern": "^[A-Za-z0-9_-]{43}$"
      }
    },
    "delegation_keys_ref": {
      "type": "string"
    },
    "cases": {
      "type": "array",
      "minItems": 1,
      "items": {
        "type": "object",
        "additionalProperties": false,
        "required": [
          "case_id",
          "construction",
          "delegation_fault",
          "delegation_file",
          "delegation_id",
          "call",
          "expected_work_order"
        ],
        "properties": {
          "case_id": {
            "type": "string",
            "pattern": "^[A-Za-z0-9][A-Za-z0-9._-]{0,127}$"
          },
          "construction": {
            "type": "string",
            "minLength": 1
          },
          "delegation_fault": {
            "enum": [
              null,
              "widened",
              "expired",
              "out_of_scope"
            ],
            "description": "How the delegation was built; the expected delegation verdict is refuse exactly when this is set."
          },
          "delegation_file": {
            "type": "string",
            "pattern": "^[A-Za-z0-9._/-]+\\.json$"
          },
          "delegation_id": {
            "type": "string",
            "minLength": 1
          },
          "call": {
            "type": "object",
            "additionalProperties": false,
            "required": [
              "asset",
              "value",
              "decision_time"
            ],
            "properties": {
              "asset": {
                "type": "string"
              },
              "value": {
                "type": "number"
              },
              "decision_time": {
                "type": "string",
                "pattern": "^\\d{4}-\\d{2}-\\d{2}T\\d{2}:\\d{2}:\\d{2}Z$"
              }
            }
          },
          "work_order": {
            "type": "object",
            "additionalProperties": false,
            "properties": {
              "asset": {
                "type": "string"
              },
              "min": {
                "type": "number"
              },
              "max": {
                "type": "number"
              },
              "valid_from": {
                "type": "string",
                "pattern": "^\\d{4}-\\d{2}-\\d{2}T\\d{2}:\\d{2}:\\d{2}Z$"
              },
              "valid_until": {
                "type": "string",
                "pattern": "^\\d{4}-\\d{2}-\\d{2}T\\d{2}:\\d{2}:\\d{2}Z$"
              }
            },
            "description": "Overrides of the default work order (asset of the call, 19.0..21.0 degC, the decision day)."
          },
          "expected_work_order": {
            "enum": [
              "pass",
              "refuse"
            ]
          },
          "expected_aps_reason": {
            "type": "string",
            "minLength": 1,
            "description": "Pre-registered machine-readable verifier reason, including pass cases; never inferred from verifier output."
          }
        }
      }
    },
    "evaluation_profile": {
      "const": "identity-reason/v2"
    }
  },
  "allOf": [
    {
      "if": {
        "required": [
          "evaluation_profile"
        ]
      },
      "then": {
        "properties": {
          "cases": {
            "items": {
              "required": [
                "expected_aps_reason"
              ]
            }
          }
        }
      }
    }
  ]
}
